title,imdb_id,release_year_movie,movie_rating,duration_movie,average_star_rating_movie,vote_count_movie,review_text,book_authors,average_rating_book,num_pages_book,ratings_count_book,publication_date_book,publisher_book
Never Let Me Go,tt1334260,2010,R,1h 43m,7.1,157000,"I had read the book and loved it. But this movie isn&#39;t for just anyone. I went to the sneak preview last night and there are always people who go to ANY movie because it&#39;s free -- those people hated this movie. My rant is it is their responsibility to do a little homework about a movie -- don&#39;t just go because it&#39;s free! That said...what a beautiful film. The visuals are something you will remember, the acting is superb, the cast (the kids as the young students and the older kids), the horror of &quot;the secret&quot; and then the unveiling of the reason for &quot;hope&quot; they cling to. One of the best reasons to see this movie is that you will need to think about topics you have not ever grappled with before. Your memories and opinions of this movie should be haunting and unforgettable. It is not a happily-ever-after film and is quiet, slow, and deep. The music is wonderful. Think of this as a foreign film and go with that in mind.",Kazuo Ishiguro,3.82,288,380646,8/31/10,Vintage Books
The Music of Chance,tt0107623,1993,R,1h 38m,7.0,2700,"A favorite from the actual 90&#39;s this film and the book by the amazing Paul Auster it&#39;s based on is still a mind bending thriller. You can see how it&#39;s influenced filmmakers like Charlie Kaufman and others, and deserves a wider audience. Give it a chance, lol, it will stay with you in that rare way wildly imaginative films do.",Paul Auster,3.9,217,361,12/1/91,Penguin Books
Don Quixote,tt3954876,2015,Not Rated,1h 23m,5.3,501,"I enjoyed this romp through Don Quixote&#39;s world.
Have seen most of the movies based on Cervantes book, and this is a pretty good take.
I enjoyed the versions starring Peter O&#39;Toole and John Lithgow and this one is also gives a good overview of the story.
I say watch all the movies you can about Don Quixote, but read the book.",Miguel de Cervantes Saavedra/Edith Grossman/Harold Bloom,3.87,940,4956,4/26/05,Ecco
Dreamcatcher,tt0285531,2003,R,2h 14m,5.5,98000,"Man, where does Stephen King comes up with this things? Again, we have the childhood friends we think we know from &quot;Stand by me&quot; only this time they&#39;re older, have weird powers and face some really nasty creatures. I just come from watching it for the first time and i just wanted to say: What a weird movie!! I&#39;ve seen some really weird movies, but this one... It&#39;s sort of a mixture of horror, sci-fi, comedy... At some point you don&#39;t know whether to be disgusted or to laugh! The special efects are great, and so is the music (&quot;On blue bayou...&quot;}. It may not be a great movie, but it&#39;s great entertainment. And it&#39;s sooooooo insane!!!! I liked it. Go see it.     7/10",Stephen King/William Olivier Desmond/Maria Teresa Marenco,3.63,688,136312,3/1/02,Albin Michel
The Other Boleyn Girl,tt0467200,2008,PG-13,1h 55m,6.7,123000,"If you want a good movie about Henry VIII and Anne Bolyen, rent Anne of the Thousand Days. That was a film that used history to tell a story about real people who had a love to change a nation. In this version of the eponymous Phillipa Gregory novel, historical inaccuracies abound. Approximately fifteen years are compressed into two hours with no indication time has gone by except for various babies. None of the characters ever change or grow any older. The characters in this movie are completely one-sided. Anne is ambitious. Henry is a womanizer. Mary is simple. No one has any complexities. The sisterly rivalry plays out like an underdeveloped soap opera. On the other hand, the film is engaging and the costumes lovely. Same with the gorgeous palace settings. Eye candy it is. Truthful or realistic it isn&#39;t.",Philippa Gregory,4.06,664,3111,11/9/04,Atria Books
Madame Bovary,tt2334733,2014,R,1h 58m,5.7,9100,"First, the short summary at the top of the IMDb page COMPLETELY MISREPRESENTS the plot of the movie and novel. Madame Bovary is not simply cheating on her husband to advance her social status.Her affairs are part of a much more profound struggle for transcendence from the ordinary life in which she feels trapped. That&#39;s why the novel is a classic of modern literature. The way IMDb puts it makes it sound like a cheap Lifetime movie.Second, Mia Wasikowska is a fine actress but I&#39;ve always imagined Madame Bovary as a much more sensual woman.Third, I think Ezra Miller was terribly miscast as Leon Dupuis. Not to disparage his acting, but he&#39;s far too young and effeminate to be an object of desire for Emma Bovary.While the film was beautifully shot, it otherwise doesn&#39;t quite do justice to Flaubert. Perhaps my expectations were too high.",Gustave Flaubert/Geoffrey Wall/Michèle Roberts,3.67,327,3620,12/31/02,Penguin Classics
Macbeth,tt2884018,2015,R,1h 53m,6.6,61000,"Was actually really looking forward to seeing this 2015 film version of &#39;Macbeth&#39;. The play is one of Shakespeare&#39;s best, most famous and most quotable and has leant itself to film, with Roman Polanski, Orson Welles and Akira Kurosawa all giving it splendid treatment. The cast is a talented one, having often admired Michael Fassbender, Marion Cottilard and David Thewlis and ever since seeing him in &#39;The Borgias&#39; Sean Harris struck me as one to watch.Not to mention the great reviews. Was a little worried though too, seeing that it was directed by Justin Kurzel who directed the big misfire and huge waste of potential that was &#39;Assassins Creed&#39;. Luckily, this &#39;Macbeth&#39; lived up to expectations on the whole if not exceeding them. It is not the definitive version of the play, either on film or filmed production, and did have room for improvement, but for all its flaws the film on the whole surprisingly impressed me.This &#39;Macbeth&#39; isn&#39;t perfect. It is agreed not always easy to understand the dialogue, which didn&#39;t need to be as hushed or as muttered. While the film a vast majority of the time looked absolutely great, there is a gratuitous overuse of slow-motion.Especially in the first 10 minutes or so, which were more sluggish than arresting. There are cuts and some of the omissions do affect the drama where the storytelling becomes less coherent.For all those drawbacks, there are a lot of positives with this &#39;Macbeth&#39;. Other than the slow motion, it is quite an amazing looking film, with hugely atmospheric and grandiose visuals (from the suitably myterious fog early on right up to the boldly bloodthirsty climax). The photography to me was some of the best of that year, especially in the act and those locations are hugely effective in their atmosphere, uncompromising but also oddly beautiful and dark without taking it to extremes. The music is still haunting and Kurzel&#39;s direction is bolder and less muddled than it was in &#39;Assassins Creed&#39; from the following year.Moreover, although it would have been nice if it was more consistently intelligible, Shakespeare&#39;s text is still powerful and hard to forget. The story takes time to get going but does get more compelling and remarkably ambitious, at its most emotionally investable from the point where Macduff learning of his family&#39;s murder (which has always been a very moving part of the plot) up to the end. The action is both exciting and ferociously harrowing, pulling no punches without being too unnecessarily over the top (seeing as &#39;Macbeth&#39; is already a dramatically brutal play).Some interesting changes here. Really did like that the witches weren&#39;t portrayed in a way that was too reliant on witch cliches, and were spooky underneath their deceptive exteriors. Lady Macbeth is still an effective and steely manipulator but it was interesting to see a more conflicted side to her (very different as it is not what the play indicates) rather than her being completely villainous. This is not going to work for some, but to me it was interesting. The performances were on the whole great from all, Fassbender is searingly fierce in the title role without being too brutish and Cotillard contrasts with him effectively as a steely and imperious Lady Macbeth. Paddy Considine&#39;s Banquo is suitably noble and Harris proved in &#39;The Borgias&#39; that he could do creepy but also tortured, and he is very moving here as Macduff. It is somewhat sad that Duncan&#39;s role in the play is not bigger because Thewlis, while perhaps a touch young, commands the part extremely well.In conclusion, intriguing and well done but there are better versions of &#39;Macbeth&#39; around. 7/10",William Shakespeare,3.9,249,592315,7/1/13,Simon  Schuster
Death on the Nile,tt0077413,1978,PG,2h 20m,7.3,42000,"This movie was the first and best of Peter Ustinov&#39;s performances as Hercule Poirot.  Though physically not very accurate to Agatha Christie&#39;s description of the little Belgian detective, for this one movie everything worked and the discrepancy was not a problem.  The film is well-paced, with all the plot turns and clues coming with perfect timing, not too fast to be confusing, but not too slow to strain the rather flimsy fabric of the story. The whole cast is very good, especially Bette Davis as a malevolent old spider of a woman, gleefully tormenting her long-suffering companion, Maggie Smith. The scene where she smiles indulgently at a group of Egyptian children waving at her on the river bank, only to sink into mortified disgust as they turn around and moon her, is a highlight of the movie.  The climax of the film is quite surprising, and unlike many mysteries, does not cheat the viewer by withholding vital information until the last moment.  We feel the pleasure of being honestly fooled throughout, and the conclusion is thoroughly satisfying.",Agatha Christie,4.1,351,674,3/30/07,Black Dog & Leventhal Publishers
Evil Under the Sun,tt0083908,1982,PG,1h 57m,7.0,22000,"Peter Ustinov recreates the role of Poirot, following the wonderful Death On The Nile.   This is not the story as Agatha Christie wrote it, but here we have a rare example of the movie being better than the book.  In fact it would be more accurate to say that here we have a murder mystery based on an idea by Miss Christie.  We are presented with is a cast of characters, a murder victim, and just about everyone has a motive. Poirot of course, deduces who did it.  The sun in question, under which this evil takes place, shines down on a privately owned island in the Mediterranean, giving us a warm and exotic location.There isn&#39;t one bad performance among the cast, several of whom have appeared before in at least one other Poirot story.  Maggie Smith and Jane Birkin in Evil Under The Sun;  Dennis Quilley and Colin Blakely in Murder On The Orient Express.   Diana Rigg and Maggie Smith almost steal the show as two women who smile sweetly at each other as they spit venom!  But every bit as good are Blakely, Quilley, Mason, McDowall and the rest.  And while all this is going on, the soundtrack is solid gold Cole Porter, which has been orchestrated perfectly to fit the story.This movie is pure fun.  Make yourself comfortable, suspend disbelief and allow yourself to be transported to another era and location for a couple of hours of enjoyment.",Agatha Christie,3.97,220,36334,9/1/06,Black Dog & Leventhal Publishers
Dead Man's Folly,tt0090914,1986,Not Rated,1h 30m,6.3,2400,"I haven&#39;t read the book Dead Man&#39;s Folly, and this TV movie is the only one of the 6 movies Peter Ustinov did as Poirot, where that is the case. Now Dead Man&#39;s Folly I found to be very entertaining, with very good performances and a fine denouncement. However the script was weak and underdeveloped in places, the music didn&#39;t really stand out unlike Death On the Nile(the music was absolutely superb in that movie) and I found the overall film to be a tad too broad. I don&#39;t think it is as good as Death on the Nile or Evil Under the Sun, which are the best of the Ustinov outings. On a positive note, for a TV movie, it looks beautiful, with wonderful period detail, pleasant scenery and very nice photography. And the clothes were lovely to look at too. The denouncement is very unexpected and cleverly done, and I wouldn&#39;t have guessed it in a million years. But what makes the film so enjoyable is the cast. While I still consider David Suchet to be the definitive Poirot, Peter Ustinov was still a joy to behold and is clearly enjoying himself. Jean Stapleton positively brings life to the proceedings as Ariadne Oliver. Both Kenneth Cranham and Tim Piggott-Smith give good performances, if playing it safe. Jonathan Cecil is very entertaining as Hastings and Nicollette Sheridan is lovely as Hattie. But other than Ustinov the standout was indeed Constance Cummings as Amy, a truly delightful performance. All in all, while not the best of the Ustinov Poirot outings, it is a glossy and entertaining one, and actually one of the better ones. 7.5/10 Bethany Cox",Agatha Christie/David Suchet,3.79,6,12256,9/8/06,BBC Audiobooks
And Then There Were None,tt0037515,1945,Approved,1h 37m,7.4,18000,"This is a dramatization of the consummate Agatha Christie book, the benchmark for the whodunit.  Each of the characters is nicely portrayed by accomplished actors.  The pacing, the subdued dialogue, all make this film work, even though it was felt necessary to doctor the plot and rename characters (this I will never understand).  I won&#39;t criticize because I&#39;ve never felt that we should compare movies to books--they are different media--unless the plot is badly compromised.  This one is not.  I remember being really pleased as a young viewer that Christie is able to bring all issues to a resolution in a believable and realistic way--no hidden doors--no strange interventions.  She is able to do this even in her lesser books.  Sometimes it is preferable to not be open ended, leaving unfinished details.  I relish this author and the movies and movie portrayals of her books.I also need to mention the music.  The score is so carefully tuned to the actions of the characters.  The black and white photography lends itself well to the oppressiveness of the setting where the characters find themselves.  You definitely should see this film.",Agatha Christie,4.26,264,625767,5/3/04,St. Martin's Press
The Sicilian,tt0093966,1987,R,1h 55m,5.4,5700,"For entertainment value, Cimino&#39;s &#39;The Sicilian&#39; does not deliver in the Hollywood sense. That&#39;s good in my opinion.It viewed some where between documentary and romantic fairy tale. Maybe to many, the latter choice would be more appropriate. I&#39;d place Sicilian, Salvatore Giuliano or Lambert&#39;s portrayal smack in the middle. That&#39;s because even after doing much research I&#39;m still not sure who the real character was. Probably, no one really knows for sure.The plot moves along fine except for the opening flashback from Turturro&#39;s cell. Cimino should have axed the scene first cut. The inclusion of the American governess did not help the story line either. In fact, she, the actress gave an unconvincing and unflattering portrayal of Americans (the rich ones) living abroad. At times she swore like a trooper. Most of the film she sounded and looked like a hooker in communist garb, designer that is. I was so glad when she fell off the reel.The rest of supporting cast was complementary. Giuliano&#39;s accomplices were good enough and just bad enough to add intrigue. Even the crotchety old professor was a good fit as interlocutor between Giuliano, his loyal band of unhappy bandits, the fickle mob and the stripe changing church.The film&#39;s one weakness is the behind the scene&#39;s love affair between the Mafia Don and Giuliano. I found it confusing. Do competing mobsters profess such unrequited love? Perhaps they do in Sicily.If you&#39;re looking for something in the genre of the non-stop murderous mobster films, then give this one a miss. However, if you are fascinated with Sicily and their mysterious culture, &#39;The Sicilian&#39; will give you some good glimpses of the stunning mountain terrain, cosmopolitan Palermo and its people both big and small, good and bad.",Mario Puzo,3.97,416,16557,5/1/01,Ballantine Books
Patriot Games,tt0105112,1992,R,1h 57m,6.8,125000,"If I were to make a quick summary of this movie, it would be &quot;a good, but not great, action flick.&quot;  I don&#39;t think this movie was intended to be innovative, to be great, to be memorable.  What it was intended to be was entertaining, and it lived up to this expectation.Harrison Ford is the master of remaining as low-key as possible.  He has had so many films where he can over-emphasize, over-dramatize, and simply over-act.  Ford has the maturity to keep this from happening, and he does so again in this film.  Ford is supported quite well with such actors/actresses as James Earl Jones (reprising his role as Greer from The Hunt for Red October), Samuel L. Jackson, and Anne Archer.  For an action flick, acting is much above average.It was also suspenseful...thrilling.  I thought the ending had a nice build-up and climax.  I realize this is different from the book&#39;s ending...but remember, these are two different visions...not the same one. This brings up a big point in movie-watching:  Comparing a movie to a book is the worst thing you can do.  They are two completely different genres. More importantly, as I said before, they are two different visions.I&#39;m not a big action fan.  I used to be, but anymore most stories are the same.  To this end I would say Patriot Games is fairly mainstream. However, it was always fun to watch and sometimes thrilling to watch.  I&#39;m also not a big Tom Clancy fan, but I&#39;ve given the movies based off his books a shot because again they are different visions.  The result is (at least with Patriot Games) a good film to watch on a Saturday night with a bowl of popcorn.  Don&#39;t expect great things, but don&#39;t expect to be disappointed, either.Rating:  7/10",Tom Clancy,4.14,503,170797,5/1/92,Berkley
Word of Honor,tt0369059,2003,,1h 31m,6.4,612,A very good TNT original movie made for TV. A former Army Lieutenant(Don Johnson) sees his world falling apart when allegations that his platoon slaughtered innocent civilians thirty years ago in a hospital massacre. Jeanne Tripplehorn plays the Army Major prosecutor. The defending attorney is played flawlessly by Arlin Howard. Also in the cast is Sharon Lawrence as the Lieutenant&#39;s lovely wife; John Heard as the platoon member &quot;blowing the whistle&quot; and Johnson&#39;s son Jesse plays the young Lieutenant in Vietnam. Good courtroom drama. Well worth watching. It&#39;s also nice seeing Johnson letting go of some of the ego. He is aging nicely and still can command a scene.,Nelson DeMille,4.17,880,8296,9/1/98,Grand Central Publishing
The Handmaid's Tale,tt0099731,1990,R,1h 48m,6.0,12000,"This is a nightmare vision of the future. It seems 1 out of every 100 women is fertile (for some reason). The ones who aren&#39;t perform slave labor. The ones that are are &quot;sold&quot; off to rich families where they have sex with the husband to produce a baby. Kate (the late and missed Natasha Richardson) is one such servant to Serena Joy (Faye Dunaway) and her husband the Commander (Robert Duvall). Kate wants out--but it seems there&#39;s no way.The synopsis only scratches the surface of a VERY dark and disturbing movie. It slowly shows how women are treated and used and it just gets more horrifying as it unfolds. The parallels to Hitler&#39;s Nazi Germany are fairly obvious but here we have barren women instead of Jews and gays. The good acting by everybody makes this hard to shake off. Aidan Quinn (as Nick) and Duvall are OK; Victoria Tennant is chilling as a leader of the camps; Elizabeth McGovern is just great as a fellow prisoner who befriends Kate; Dunaway is also very good in her role. Best of all is Richardson. This couldn&#39;t have been an easy role but she pulls it off beautifully. She died at far too young an age. This is basically an unknown movie and it&#39;s easy to see why--it&#39;s far too dark and disturbing for a general audience. However the ending is (sort of) uplifting (and changed from the book). Grim, dark and depressing. View it at your own risk. The ceremony sequences are almost impossible to watch and shocked the hell out of me the first time I saw this.",Margaret Atwood/Valerie Martin,4.11,350,2102,10/17/06,Everyman's Library
The Wizard of Oz,tt0032138,1939,G,1h 42m,8.1,450000,"Fantastic tale about a Kansas farm girl who&#39;s spirited off to the wondrous land of Oz. The film still tingles with freshness and beauty. Garland is forever memorable as Dorothy Gale, the young girl and the supporting performances of Bolger, Lahr,Haley, Hamilton and Morgan are all stand out and will remain national treasures. The superb songs of E.Y. Harburg and Harold Arlen are still beautifully blended with the lovely photography, cinematography and art direction. Unforgettable!!!",Salman Rushdie/Richard Maltby/Melvyn Bragg,4.0,69,749,5/27/92,British Film Institute
One Flew Over the Cuckoo's Nest,tt0073486,1975,R,2h 13m,8.7,1100000,"I went into this film with the knowledge that it had been the second film in history to win the &#39;top five&#39; Oscars (for Best Picture, Best actor, Best actress, Best director and best screenplay) and has been praised as &quot;one of Jack Nicholson&#39;s finest roles&quot; and &quot;one of the classics of the 70&#39;s&quot;. Naturally, after hearing all this, I had high expectations for One Flew over the Cuckoo&#39;s Nest. But nonetheless, I was surprised at how easily the film surpassed my expectations and easily led me to understand how it merited all that praise.Based on the novel by Ken Kesey, the story follows Randle Patrick McMurphy (Jack Nicholson), who, in an attempt to get out of spending more time in prison, pleads insanity for his crime, and is therefore sentenced to time in a mental institution. This was McMurphy&#39;s intention, as he believes the conditions in a &quot;crazy house&quot; will be significantly easier to contend with than another harsh stay in prison. However, he quickly finds out that surviving the institution with it&#39;s desolate patients (including Christopher Lloyd, Danny DeVito, Vincent Schiavelli and an absolutely brilliant Brad Dourif as the stuttering Billy Bibbit) and the monstrously repressive Nurse Ratchet (Louise Fletcher, in a career defining role) is considerably harder than he imagined. McMurphy plays pranks, horseplay, and is generally defiant to the rules of the institution in an attempt to raise spirits. His constant optimism and reckless defiance to the out of date rules in the institution can be very uplifting, and often quite funny as well, but much of the movie can be very depressing - the generally decrepit state of the institution is a consistently (and intentionally) bleak background to a superb story with a truly bittersweet ending.Jack Nicholson is at his best here, head and shoulders above other excellent performances such as in &#39;Chinatown&#39; or &#39;As Good as it Gets&#39;. McMurphy is an apparently unquenchable optimist, refusing to succumb to the defeated spirit of all the other patients. His livewire antics, inspiring the patients are generally uplifting, and when his indomitable spirit is finally broken, we really feel for him and his fellow patients. Nicholson conveys the essence of McMurphy to perfection, demonstrating his excellent understanding and interpretation of the character. When McMurphy announces that he is going to lift a huge stone fountain and hurl it through the window to escape, the other patients are so caught up in his intoxicating spirit of freedom that they honestly believe he can do it, despite the fact it would be impossible for a man much stronger than him. When McMurphy finally discovers that despite his best efforts, he cannot lift the fountain, he is so openly crushed that we can&#39;t help but feel for him. Beneath the frequent profanities and livewire antics, there are real human emotions, which come across as truly touching.What can be said about One Flew over the Cuckoo&#39;s Nest which hasn&#39;t already been said? It has an excellent storyline, top notch acting, painfully bleak visuals, perfectly setting the tone for the movie, and alternates between being truly uplifting to devastatingly depressing. It features perhaps the most memorable film ending ever, next to a man on his horse riding off into the sunset, and leaves the viewer beaten down by the conflicting emotions, unaware what to think of the picture next to reveling in it&#39;s glorious entirety. It&#39;s hard to produce a final outcome any better than this.-10/10",Ken Kesey,4.2,272,1120,2/1/63,Signet
