title,imdb_id,release_year_movie,movie_rating,duration_movie,average_star_rating_movie,vote_count_movie,review_text,book_authors,average_rating_book,num_pages_book,ratings_count_book,publication_date_book,publisher_book
Interview with the Vampire,tt0110148,1994,R,2h 3m,7.5,362000,"Based on the Anne Rice&#39;s novel and with a screenplay adapted by herself, this film tells the story of Lestat and Louis, two vampires with over three hundred years. Directed by Neil Jordan, has the participation of Brad Pitt, Tom Cruise and Kirsten Dunst (as a child). It received two nominations for the Oscar (Best Art Direction, Best Original Score).This is the film adaptation of one of the greatest horror novels of this American author, and is even more appealing when we realize that she actively collaborated with the production, signing the adaptation of the script. Indeed, it&#39;s a great script, faithful to the novel and original story. And for me, this movie has another good note: fully escaping the recent &quot;sex symbol vampire&quot; cliché, fueled by movies like &quot;Twilight&quot;, this film depicts vampires as they really should be: monsters with some psychological depth.The actors are excellent in their roles. The highlight goes obviously to Pitt and Cruise, who were not only perfectly able to give charisma to the characters but also not ignore the importance of the psychological characteristics. Pitt took it to the extreme in his character, torn between the love of his own humanity and the overwhelming desire for blood he feels. The way both actors share the scene is irresistible, such as how Cruise transforms his character in &quot;evil genius&quot; of his friend.The film contains several very intense scenes with moments that can hurt some sensibilities. Nevertheless, its not a very bloody movie. The atmosphere is dark, sinister, something largely enhanced by the cinematography, dark and misty, and the soundtrack, worthy of a good horror movie (something that this film is definitely not). The special, visual and sound effects are good, such as the characterization and makeup. The costumes are exceptional, portraying accurately the clothes of the several historical periods portrayed throughout the film.",Anne Rice,3.99,342,433413,8/31/04,Ballantine Books
Jurassic Park,tt0107290,1993,PG-13,2h 7m,8.2,1100000,"This movie is definitely one to remember. Despite being filmed in the 90s, Jurassic Park continues to be a classic to this day. 
Watching the movie now highlights the contrast between the effects then and the special effects available now. This, along with some acting that is a tad overdone, are the only real critiques I would give this film. 
The child actors were especially hilarious to me-the young boy, Timmy, has moments that really capture a reaction that a child in real life would have (&quot;I threw up.&quot; &quot;Well that&#39;s ok! That happens sometimes&quot;-Allen-is one of my favorite quotes). 
Another extremely influential aspect of this film is the music that plays over certain intense scenes and the iconic theme music in the opening/closing. The music combined with the diegetic sound of the dinosaur stomping/approaching builds the suspense and creates an intense tension in the audience. 
As a classic worldwide, it&#39;s no wonder that this movie provided the basis for generations of movies to follow.",Michael Crichton,4.02,480,451443,4/4/06,Plaza y Janes
The Green Mile,tt0120689,1999,R,3h 9m,8.6,1500000,"&quot;The Green Mile&quot; is one of my favorite Stephen King books and I have read it several times.  I was anxiously anticipating the film version, but was concerned that the emotional impact of the book could not be replicated on screen.  Fortunately this wonderful story was adapted by Frank Darabont, who did such a magnificent job bringing King&#39;s &quot;Shawshank Redemption&quot; to the screen.  He does the same high quality work with &quot;The Green Mile&quot;.  The story is faithful to the book, only losing details that were not important to the story anyway.  The casting is superb - every actor is perfectly suited for his role and does an excellent job, although I would like to single out Doug Hutchison.  His portrayal of the detestable Percy is right on the mark and suggests complexities in this character I had not discovered in the book.  The length is about three hours and it seems that critics are complaining about that.  I can&#39;t understand the complaints.  The film never drags and is never dull, and it certainly didn&#39;t feel three hours long.  The length is needed to tell this story the way it should be told, and the story is so very engrossing.  Best of all, Darabont and the actors bring so much emotion ot the screen, that I cried like a baby through several scenes. &quot;The Green Mile&quot; will haunt you.",Stephen King,4.44,592,207869,9/1/96,Penguin Signet
A Clockwork Orange,tt0066921,1971,R,2h 16m,8.2,911000,"Few films are as sensational or infamous as Stanley Kubrick&#39;s &quot;A Clockwork Orange&quot;. It&#39;s impossible to sit through ACO and not have a reaction; whether it be shock, disgust or amazement. The savage tale of a brutal young droog and his subsequent &quot;reformation&quot; by the government is as shocking and thought-provoking as ever. While the film&#39;s depictions of violence and sex are what it&#39;s most known for, ACO works on far deeper levels. The disturbing portrayal of youth and its satirical depiction of a government&#39;s attempts to create a better society are brilliant, but the most fascinating aspect of ACO is the questions it poses about good and evil. While the crimes Alex commits at the beginning of the film are atrocious, what the government does to him is worse. The film presents the absolute worst aspects of man, but shows that even these are still favorable to a man without the choice. People can denounce the film because of its brutal content, but the importance of the questions it poses can&#39;t be denied. Equally excellent to the film&#39;s content is the effort by the crew. Kubrick&#39;s perfectionism pays off well, as ACO in one of his most visually striking films. Malcolm MacDowell is nothing short of amazing as Alex. Kubrick&#39;s use of surreal imagery and set pieces, as well as the ingenious use of music to compliment the on-screen action, creates a world that perfectly reflects the protagonist&#39;s behavior and the government&#39;s policies. A Clockwork Orange is by no means an easy film to get through, as many will be turned off by the scenes of violence and rape. But this masterpiece is far more complex than a simple romp through a world of youthful violence. It&#39;s a rare example of film-making that demands that the viewer actually think. Real horrorshow all around, Oh my brothers.",Anthony Burgess/Blake Morrison,3.99,159,5366,2/24/00,Penguin Classics
The Silence of the Lambs,tt0102926,1991,R,1h 58m,8.6,1600000,"The Silence of the Lambs runs two hours.Anthony Hopkins appears for little more than sixteen minutes, yet during those minutes he hasn&#39;t bored you for a second, not even after the tenth or eleventh viewing. Such is the power of his performance, it&#39;s absolutely impossible to forget him.His character, Dr.Hannibal&quot;The Cannibal&quot; Lecter, is a brutal killer with revolting methods and habits, but he&#39;s also very intelligent, charismatic and with good taste(you can interpret that as you like).A clichè by now, but who cares? He still is one of the key elements in this wonderful thriller, which sees Jodie Foster&#39;s Clarice Starling asking for Lecter&#39;s help to catch another killer.The result is a dangerous yet fascinating relationship between the young, unexperienced FBI-agent and the convicted,but basically omnipotent, psychiatrist.He&#39;s a step ahead of everyone all the time, and makes sure everyone notices, with his witty, unforgettable one-liners.If there had to be only one reason to worship this movie, then it would have to be the chemistry between the two leading actors.Never before has a non-sexual man/woman connection been more thrilling.Never before has a film&#39;s ending been more unsettling and brilliant and left us asking for more.Best watched with a nice Chianti...P.S. dear film-buffs, have the lambs stopped screaming?",Yvonne Tasker,4.27,96,510,3/29/02,British Film Institute
The Shawshank Redemption,tt0111161,1994,R,2h 22m,9.3,3000000,"It is no wonder that the film has such a high rating, it is quite literally breathtaking. What can I say that hasn&#39;t said before? Not much, it&#39;s the story, the acting, the premise, but most of all, this movie is about how it makes you feel. Sometimes you watch a film, and can&#39;t remember it days later, this film loves with you, once you&#39;ve seen it, you don&#39;t forget.The ultimate story of friendship, of hope, and of life, and overcoming adversity.I understand why so many class this as the best film of all time, it isn&#39;t mine, but I get it. If you haven&#39;t seen it, or haven&#39;t seen it for some time, you need to watch it, it&#39;s amazing. 10/10.",Mark Kermode/Rob White,4.43,96,725,8/26/03,British Film Institute
The Shining,tt0081505,1980,R,2h 26m,8.4,1200000,"Even though The Shining is over a quarter of a century old, I challenge anyone to not get freaked out by Jack Nicholson&#39;s descent into madness. This is a rare example of something so unique that no one has been able to rip it off; instead it has been referenced time and again in pop culture. The twins, the elevator of blood, RedRum, the crazy nonsense &quot;writing&quot;... this should be seen, if for nothing else, to understand all the allusions to it in daily life. The film is simultaneously scary, suspenseful, beautiful, and psychologically intriguing. It has the classic mystery of Hitchcock and the terror of a modern thriller. And it has what horror movies usually lack: a great script.",Stephen King/Campbell Scott,4.22,16,357,8/2/05,Simon & Schuster Audio
Planet of the Apes,tt0133152,2001,PG-13,,5.7,238000,"If one wants to remake a movie, the best option is probably to choose and original that was good, but not a great classic. Clearly, any attempt to remake a concept that failed first time around is fraught with danger, but an attempt to remake a classic runs the risk that one&#39;s film will be unfavourably compared with the original. The original 1968 film of &#39;Planet of the Apes&#39; is one of cinema&#39;s great science fiction classics. More than an adventure story, it touches on some of the concerns of the late sixties- the fear of nuclear war, race relations- and also raises more fundamental issues about the relationship between man and nature, the relationship between religion and science, Darwinism and animal rights. It was therefore a brave move on Tim Burton&#39;s part to try and remake it. The main concept of Tim Burton&#39;s film is basically similar to Franklin Schaffner&#39;s. An astronaut from Earth travels to a planet ruled by intelligent apes. Humans exist on this planet, but they are regarded as an inferior species, despised and exploited by the apes. There is, however, an important difference. In the original film, the apes are the only intelligent and articulate beings on the planet. Although they have only attained a pre-industrial level of civilization (they have firearms, but no power-driven machinery, and no means of transport other than the horse or horse-drawn vehicles), they are a far more advanced species than the planet&#39;s human inhabitants, who lack the powers of speech and reason and live an animal-like existence. In Burton&#39;s remake, humans and apes have similar powers of speech and intellect; it is only the apes&#39; greater physical strength that enables them to dominate the planet and to treat the humans as slaves. It was this ironic role-reversal, with apes behaving like men and men behaving like beasts, that gave Schaffner&#39;s film its satirical power. That film was advertised with the slogan &#39;Somewhere in the Universe, there must be something better than man!&#39;, and the apes are indeed, in some respects, better than man. Their law against killing others of their kind, for example, is much more strictly observed than our commandment that &#39;Thou shalt do no murder&#39;. There is no sense that the apes are bad and the humans good. Even Dr Zaius, the orang-utan politician, is not a wicked individual; by the standards of his society he is an honourable and decent one. His weakness is that of excessive intellectual conservatism and unwillingness to accept opinions that do not fit in with his preconceived world view. (In this respect the apes are very human indeed). Burton&#39;s film takes a less subtle moral line. It is a straightforward story of a fight for freedom. The villains are most of the apes, especially the fanatical, human-hating General Thade. The heroes are Captain Davidson, the astronaut from Earth, the planet&#39;s human population who long for freedom from the domination of the apes, and a few liberal, pro-human apes, especially Ari, the daughter of an ape senator. The apes are more aggressive and more obviously animals than in the original film; they still frequently move on all fours and emit fierce shrieks whenever angry or excited. There are some things about this film that are good, especially the ape make-up which is, for the most part, more convincing than in the original film and allows the actors more scope to show emotion. (I say &#39;for the most part&#39; because Ari looks far less simian than do most of the other apes- Tim Burton obviously felt that the audience would be more likely to accept her as a sympathetic character if she looked half-human). The actors playing apes actually seem more convincing than those playing humans. Tim Roth is good as the militaristic Thade, as is Helena Bonham-Carter as Ari. Mark Wahlberg, on the other hand, is not an actor of the same caliber as Charlton Heston, who played the equivalent role in the original film, and Estella Warren has little to do other than look glamorous. (Heston has a cameo role as an ape in Burton&#39;s film, and even gets to repeat his famous line &#39;Damn you all to hell&#39;). Overall, however, the film is a disappointment when compared to the original, a simple science-fiction adventure story as opposed to an intelligent and philosophical look at complex issues. It tried to copy the device of a surprise ending but failed. Schaffner&#39;s famous final twist is shocking, but makes perfect sense in the context of what has gone before. Burton&#39;s makes no sense whatsoever.Tim Burton can be a director of great originality, but with &#39;Planet of the Apes&#39; he fell into the standard Hollywood trap of trying to copy what had already been done and remaking a film that never needed to be remade. It was good to see him return to form with the brilliant &#39;Big Fish&#39;, one of the best films of last year. 6/10",Pierre Boulle/Xan Fielding,3.95,192,88,6/6/00,Wings
Love in the Time of Cholera,tt0484740,2007,R,2h 19m,6.4,25000,"Quick, before the general release on Friday change the silent movie line back to &quot;My God, this is longer than sorrow&quot;. What did she mumble instead, was it &quot;interminable&quot;? Why was that wonderful line changed?I so loved the book, I cannot get an unbiased grip on the movie. My mind elaborated it favorably but with simultaneous disappointment over deviations like the &quot;sorrow&quot; line. &quot;Forever&quot; worked better in the book as the boat was ordered to return upstream. I do wish it had closed with the &quot;ripple&quot; video that is on the internet.The film touched too many threads while missing the book&#39;s soul, like trying to read Fermina&#39;s heart on her tongue. Maybe it isn&#39;t possible for a movie to do justice to any masterpiece but Florentino&#39;s long-standing relationships with the widows are as important as the &quot;body count&quot;. Young Fermina was too old, as was America. I would have cast a 15-year-old as the young Fermina and have had her reappear as America with died hair or similar artifice. I cannot forgive the script for ignoring the perversion and her suicide. I would have rather America had been entirely written out.Bardem was the perfect Florentino. Fernanda Montenegro and Hector Elizondo gave terrific performances. Marcela Mar is such a heart-throb I nearly forgive her for being twice her age. Cartagena was underplayed. The Shakira soundtrack was ideal.I&#39;ll reluctantly recommend the movie but won&#39;t shake peoples&#39; shoulders as I do when I tell them that they must read the book.",Gabriel García Márquez/Edith Grossman,3.91,348,324487,10/5/03,Vintage International
Carrie,tt0319970,2002,Not Rated,2h 12m,5.4,12000,"It seems to make as much sense to remake a great movie like Brian DePalma&#39;s 1976 horror/suspense masterpiece CARRIE for television as it did to make a sequel of it in the form of THE RAGE: CARRIE 2 three years before, but that&#39;s what has been done.  A lot of bells and whistles have been added to this television remake, but in the end this CARRIE is still in the shadow of the DePalma original.Angela Bettis (GIRL INTERRUPTED) has the unenviable task of stepping into the shoes (and the prom dress) of Sissy Spacek in the title role of a New England teen tortured at school by cruel classmates (because she doesn&#39;t belong) and at home by her religiously fanatical mother (Patricia Clarkson, in the Piper Laurie role).  Soon, she discovers she has telekinetic powers; and when the most gruesome of gags is played on her on prom night, all bets are off.Though looking much more glazed in the eyes than Spacek ever did, Bettis gives a fairly good performance as Carrie; and Clarkson&#39;s portrayal of her uprighteous mother is much more low-key, but no less threatening, than Laurie&#39;s portrayal.  The special effects, however obvious they might be, are also quite good.  But in the end, the reputation of the 1976 original, with its combination of psychological horror and teen-angst drama, still hovers over this remake.  Nowhere is this more apparent than in the pig&#39;s blood scene.  It doesn&#39;t have the same jarring emotional impact this time around--not so much because we&#39;ve seen it before, but because here it looks slightly laughable when the blood gets poured onto Bettis.  Because of DePalma&#39;s use of slow-motion in the original, the blood hits Spacek like a tidal wave.I give the CARRIE remake a &#39;6&#39; just for trying.  I only regret that its shortcomings as a film have less to do with its execution as a film than the fact that the original movie still resonates much more fully.",Stephen King,3.96,253,2707,10/1/99,Pocket Books
Gone with the Wind,tt0031381,1939,G,3h 58m,8.2,346000,"I&#39;ve seen the film many times, have always enjoyed it. But I&#39;ve been reading the book for the first time. It&#39;s a very long novel, and you have to stay with it if you want to see the ending. It&#39;s a good read, but Margaret Mitchell, former newspaper reporter, is very thorough in her description of both Southern culture and the changes that the Civil War brought to it. It&#39;s the size of the book that was the biggest challenge for David O Selznick. Not what parts to film, but which parts to leave out. So many characters that appeared in the book couldn&#39;t be introduced in the movie without extending the film&#39;s length to well over four hours. So he had Sidney Howard write the screenplay, then cut that down to a filmable length by hiring several more writers to further pare the script, and was still rewriting it himself while it was being filmed. Selznick was close to running out of money, so he asked his angel, millionaire Jock Whitney, to loan him enough to finish the film. The film was finally completed and edited, then was test-marketed at a theatre not far from LA. The viewers were excited about having seen it and said so on their preview cards, which allowed Selznick to rest easy, knowing he had a hit on his hands.",Margaret Mitchell,4.29,1037,999139,4/1/99,Warner Books
Oliver Twist,tt0380599,2005,PG-13,2h 10m,6.8,35000,"Polanski is the kid of guy who likes to dance on the edge. A mixture of clown, genius and artist who has suffered personal tragedy and humiliation but one who keeps cranking amazing films. This Oliver Twist is no exception. Polanski has reworked the story and taken out the 19th century coincidences, e.g., the highly improbable fact that Oliver is Brownlow&#39;s grandson and the business with the portrait of Oliver&#39;s mother, given the old tale a fresh coat of paint with new amazing character actors such as Leanne Rowe, a young and thoroughly charming Nancy, Henry Eden, a scamp of a Dodger, Jamie Forman, a repulsive Bill Sykes with no redeeming features whatsoever and the veteran Edward Hardwicke as Brownlow. But, it&#39;s young Barney Clark who steals the show. In past versions, Oliver is merely a device upon which the other array of characters are hung. We&#39;ll all remember Sir Alec Guinness, Richard Dreyfus and Ron Moody&#39;s Fagin, Oliver Reed and Robert Newton&#39;s Bill Syke, Elijah Wood, Anthony Newley and Jack Wild&#39;s Dodger but who were the Olivers? We will remember young Master Barney Clark in this marvelous, intriguing and eye-pleasing Oliver.",Charles Dickens,3.86,368,2077,12/30/02,Dover Publications
Fight Club,tt0137523,1999,R,2h 19m,8.8,2500000,"Fight Club does exactly what movies should do, blow our minds, make us ask questions of ourselves and our society, and all the while thoroughly entertain us. Edward Norton and Brad Pitt are at their very best.",Chuck Palahniuk,4.19,218,388782,10/17/05,W.W. Norton & Company (NYC)
A Beautiful Mind,tt0268978,2001,PG-13,2h 15m,8.2,1000000,"A Beautiful Mind
Director Ron Howard has experience in playing with his audience&#39;s heartstrings. Remember in Apollo 13, when the fate of the astronauts was uncertain? (Ok, so if you remember your recent history, you knew.... but still!) Or remember in Parenthood, when Steve Martin&#39;s kid was about to make the crucial catch? Ol Opie can still pluck those strings with the best of them. (And you know, he&#39;ll never stop being called Opie, even by those of us who never saw The Andy Griffith Show during its initial run.) And plucking heartstrings is not a bad thing at all, not when you can do it in such a sincere, noncloying way as the masterful Beautiful Mind presents to its viewers.John Nash is a mathematics prodigy who has a decided knack at solving previously unsolvable problems. He&#39;s socially dysfunctional, rarely looking anyone in the eye, but pours all of his energy - and soul - into producing one original idea, an idea that will distinguish him from all of the other mathemathical minds at Princeton University.But John, like most who have had movies made about them, had his ups and downs. He meets and falls for a beautiful student of his named Alicia (Jennifer Connelly), and they produce a baby. But John also suffers from tremendous delusions and is diagnosed with a form of schizophrenia. Schizophrenia&#39;s a tough disease, folks - it&#39;s still not fully understood, and Nash was diagnosed with it in the middle of last century. He spends time in a sanitarium, as doctors struggle to find a cure.Russell Crowe is absolutely powerful as the confused and confusing Nash. Although the marquee says &quot;Russell Crowe&quot;, you&#39;ll immediately forget this is the hunky guy from Gladiator. I mean after all, he&#39;s playing some nerdy scientist dude! But Crowe completely disappears in the role, and he&#39;s unforgettable. Actors kill for roles like this one, because it gives them a chance to show off their acting chops. For many actors, this is the kiss of death, because then they&#39;re exposed as poor thespians. But not for Crowe; if anything, this proves once and for all that he&#39;s a grand master of acting. I realize that sounds like overkill for him, but I think that when actors are labeled as a &quot;hunk&quot; - their skills as actors aren&#39;t seen as very substantial. Hey, looking darn good worked against Tom Selleck, and to a degree it has worked against Crowe as well.And he ages well, too. The movie takes place over a fairly extended period of time, ending with Nash&#39;s acceptance of the Nobel Prize in 1994. The makeup on Nash is neither garish nor schmaltzy; he looks completely genuine. And that&#39;s the essence of Crowe&#39;s performance. It&#39;s sincere, never trying to win over the audience with a sly wink here or a toss of the hair there. Crowe shows remarkable poise, elegance, and is utterly astounding in the role.His supporting cast is more than able. Jennifer Connelly is better than I thought she would be; in most roles, she&#39;s the eye candy. But this role had meat to it, and she held her own. It wasn&#39;t an easy role to play, and she pulled it off. And her scenes with Crowe do have that movie magic that each of us looks for when we go to movies, that one moment, that compatible chemistry that leaves audiences mesmerized.And yes, this does have some very, very touching moments. The final scene, while predictable (even if you don&#39;t know the outcome in real life), will bring more than one tear to the eye. Yes, I&#39;ll admit it, it got me right here. But it&#39;s okay; I did that old &#39;guy-crying-in-movie-theater&#39; trick. If you feel the brime falling from the lid, you make a motion toward your cheek and then you scratch vigorously; people might think you have a skin infection and move away slowly, but at least they won&#39;t think you&#39;re a girly man.At any rate, it&#39;s certainly one of the best movies of the year. Everything&#39;s in place: the direction, the photography, and especially the acting.",Sylvia Nasar,4.13,461,115201,2/4/02,Faber  Faber
